B1: San Francisco Bay Area Alumni Group Survey
A2: SPECIAL INTERESTS
C3: Total | E3: SF/Peninsula | G3: Berk/East Bay | I3: Silicon Valley | K3: North Bay
A4: Total responses | D4: =F4+H4+J4+L4 -> 192 | F4: 98 | H4: 50 | J4: 31 | L4: 13
A5: special interest grps? | B5: book club | C5: =E5+G5+I5+K5 -> 71 | D5: =C5/D$4 -> 0.36979166666666669 | E5: 45 | F5: =E5/F$4 -> 0.45918367346938777 | G5: 14 | H5: =G5/H$4 -> 00.28 | I5: 8 | J5: =I5/J$4 -> 0.25806451612903225 | K5: 4 | L5: =K5/L$4 -> 0.30769230769230771
B6: bridge | C6: =E6+G6+I6+K6 -> 17 | D6: =C6/D$4 -> 8.8541666666666671E-2 | E6: 8 | F6: =E6/F$4 -> 8.1632653061224483E-2 | G6: 4 | H6: =G6/H$4 -> 00.08 | I6: 2 | J6: =I6/J$4 -> 6.4516129032258063E-2 | K6: 3 | L6: =K6/L$4 -> 0.23076923076923078
B7: live music | C7: =E7+G7+I7+K7 -> 47 | D7: =C7/D$4 -> 0.24479166666666666 | E7: 26 | F7: =E7/F$4 -> 0.26530612244897961 | G7: 11 | H7: =G7/H$4 -> 00.22 | I7: 7 | J7: =I7/J$4 -> 0.22580645161290322 | K7: 3 | L7: =K7/L$4 -> 0.23076923076923078
B8: investment club | C8: =E8+G8+I8+K8 -> 58 | D8: =C8/D$4 -> 0.30208333333333331 | E8: 27 | F8: =E8/F$4 -> 0.27551020408163263 | G8: 11 | H8: =G8/H$4 -> 00.22 | I8: 15 | J8: =I8/J$4 -> 0.4838709677419355 | K8: 5 | L8: =K8/L$4 -> 0.38461538461538464
B9: prog dinner | C9: =E9+G9+I9+K9 -> 49 | D9: =C9/D$4 -> 0.25520833333333331 | E9: 25 | F9: =E9/F$4 -> 0.25510204081632654 | G9: 12 | H9: =G9/H$4 -> 00.24 | I9: 10 | J9: =I9/J$4 -> 0.32258064516129031 | K9: 2 | L9: =K9/L$4 -> 0.15384615384615385
B10: comm svc | C10: =E10+G10+I10+K10 -> 82 | D10: =C10/D$4 -> 0.42708333333333331 | E10: 39 | F10: =E10/F$4 -> 0.39795918367346939 | G10: 21 | H10: =G10/H$4 -> 00.42 | I10: 17 | J10: =I10/J$4 -> 0.54838709677419351 | K10: 5 | L10: =K10/L$4 -> 0.38461538461538464
B11: toastmasters | C11: =E11+G11+I11+K11 -> 20 | D11: =C11/D$4 -> 0.10416666666666667 | E11: 9 | F11: =E11/F$4 -> 9.1836734693877556E-2 | G11: 4 | H11: =G11/H$4 -> 00.08 | I11: 4 | J11: =I11/J$4 -> 0.12903225806451613 | K11: 3 | L11: =K11/L$4 -> 0.23076923076923078
B12: comm issue discuss | C12: =E12+G12+I12+K12 -> 29 | D12: =C12/D$4 -> 0.15104166666666666 | E12: 14 | F12: =E12/F$4 -> 0.14285714285714285 | G12: 7 | H12: =G12/H$4 -> 00.14 | I12: 3 | J12: =I12/J$4 -> 9.6774193548387094E-2 | K12: 5 | L12: =K12/L$4 -> 0.38461538461538464
B13: family/kids | C13: =E13+G13+I13+K13 -> 33 | D13: =C13/D$4 -> 0.171875 | E13: 11 | F13: =E13/F$4 -> 0.11224489795918367 | G13: 10 | H13: =G13/H$4 -> 00.2 | I13: 10 | J13: =I13/J$4 -> 0.32258064516129031 | K13: 2 | L13: =K13/L$4 -> 0.15384615384615385
A15: language | B15: sports | D15: other
A16: San Francisco/Peninsula | B16: San Francisco/Peninsula | D16: San Francisco/Peninsula
A17: spanish | B17: soccer | D17: careers/networking online;
A18: french | B18: ultimate | D18: Stanford has "the farm" online; willing to help w/ anything
A19: japanese | B19: ultimate, golf | D19: golf outings
A20: North Bay | B20: bsktbll, s-ball | D20: environmental, veggie; hike/bike ride
A21: russian, hebrew, spanish | B21: baseball, football | D21: dog-related; outdoor sports
A22: Oakland/Berkeley/East Bay | B22: v-ball, wallyball, s-ball | D22: SJ Giants
A23: hebrew | B23: rugby, bsktbll | D23: triathlon training; Tahoe, Sundance film festival
A24: french | B24: v-ball | D24: in SF
A25: spanish | B25: softball | D25: gay/lesbian
A26: Silicon Valley | B26: Oakland/Berkeley/East Bay | D26: movie events
A27: spanish | B27: v-ball, cycling | D27: any, time permitting
A28: turkish, german | B28: softball, v-ball | D28: also, live entertainment gathering; both org. by email
A29: french | B29: soccer, bsktbll | D29: scrabble, golf, driving range excursions
B30: golf | D30: wine/beer tasting; scavenger hunt; provide advice to new leaders
B31: Silicon Valley | D31: physicians' group
B32: hiking, skiing | D32: arts/crafts
D33: (beginner's bridge)
D34: Oakland/Berkeley/East Bay
D35: business/prof.dev't/entrepeneurial;
D36: willing to contact alums at interesting companies to speak about their experiences
D37: supporting students of color
D38: if nearby
D39: happy to help coord. some events, help est. chapter here; esp. activities indicated
D40: wine tasting
D41: Silicon Valley
D42: get-togethers in alumni homes
D43: venture cap
D44: willing to pitch in, but not good at coordinating
D45: social cause web site
D46: cookout; hiking
D47: in South Bay
D48: North Bay
D49: hiking group; tango dance group/lessons;
D50: art/archi tours of notable buildings/homes, wineries, art studios, galleries (in Marin)
D51: cs, but not now
D52: Rice night at KQED (pledge drive)
D53: educational