B1: San Francisco Bay Area Alumni Group Survey
A2: Organization
C3: Total | E3: SF/Peninsula | G3: Berk/East Bay | I3: Silicon Valley | K3: North Bay
A4: Total responses | C4: =E4+G4+I4+K4 -> 192 | E4: 98 | G4: 50 | I4: 31 | K4: 13
A5: directory? | B5: yes | C5: =E5+G5+I5+K5 -> 162 | D5: =C5/C$4 -> 0.84375 | E5: 87 | F5: =E5/E$4 -> 0.88775510204081631 | G5: 40 | H5: =G5/G$4 -> 00.8 | I5: 26 | J5: =I5/I$4 -> 0.83870967741935487 | K5: 9 | L5: =K5/K$4 -> 0.69230769230769229
B6: electronic | C6: =E6+G6+I6+K6 -> 34 | D6: =C6/C$4 -> 0.17708333333333334 | E6: 11 | F6: =E6/E$4 -> 0.11224489795918367 | G6: 11 | H6: =G6/G$4 -> 00.22 | I6: 9 | J6: =I6/I$4 -> 0.29032258064516131 | K6: 3 | L6: =K6/K$4 -> 0.23076923076923078
B7: printed | C7: =E7+G7+I7+K7 -> 48 | D7: =C7/C$4 -> 0.25 | E7: 26 | F7: =E7/E$4 -> 0.26530612244897961 | G7: 10 | H7: =G7/G$4 -> 00.2 | I7: 7 | J7: =I7/I$4 -> 0.22580645161290322 | K7: 5 | L7: =K7/K$4 -> 0.38461538461538464
B8: internet | C8: =E8+G8+I8+K8 -> 117 | D8: =C8/C$4 -> 0.609375 | E8: 64 | F8: =E8/E$4 -> 0.65306122448979587 | G8: 30 | H8: =G8/G$4 -> 00.6 | I8: 17 | J8: =I8/I$4 -> 0.54838709677419351 | K8: 6 | L8: =K8/K$4 -> 0.46153846153846156
A9: when to meet? | B9: weekend | C9: =E9+G9+I9+K9 -> 119 | D9: =C9/C$4 -> 0.61979166666666663 | E9: 57 | F9: =E9/E$4 -> 0.58163265306122447 | G9: 35 | H9: =G9/G$4 -> 00.7 | I9: 22 | J9: =I9/I$4 -> 0.70967741935483875 | K9: 5 | L9: =K9/K$4 -> 0.38461538461538464
B10: wkday eve | C10: =E10+G10+I10+K10 -> 93 | D10: =C10/C$4 -> 0.484375 | E10: 55 | F10: =E10/E$4 -> 0.56122448979591832 | G10: 15 | H10: =G10/G$4 -> 00.3 | I10: 16 | J10: =I10/I$4 -> 0.5161290322580645 | K10: 7 | L10: =K10/K$4 -> 0.53846153846153844
B11: summer | C11: =E11+G11+I11+K11 -> 24 | D11: =C11/C$4 -> 0.125 | E11: 9 | F11: =E11/E$4 -> 9.1836734693877556E-2 | G11: 8 | H11: =G11/G$4 -> 00.16 | I11: 6 | J11: =I11/I$4 -> 0.19354838709677419 | K11: 1 | L11: =K11/K$4 -> 7.6923076923076927E-2
B12: holiday | C12: =E12+G12+I12+K12 -> 5 | D12: =C12/C$4 -> 2.6041666666666668E-2 | E12: 1 | F12: =E12/E$4 -> 1.020408163265306E-2 | G12: 2 | H12: =G12/G$4 -> 00.04 | I12: 2 | J12: =I12/I$4 -> 6.4516129032258063E-2 | K12: 0 | L12: =K12/K$4 -> 0
A13: where to meet? | B13: SF | C13: =E13+G13+I13+K13 -> 99 | D13: =C13/C$4 -> 0.515625 | E13: 53 | F13: =E13/E$4 -> 0.54081632653061229 | G13: 28 | H13: =G13/G$4 -> 00.56 | I13: 7 | J13: =I13/I$4 -> 0.22580645161290322 | K13: 11 | L13: =K13/K$4 -> 0.84615384615384615
B14: Peninsula | C14: =E14+G14+I14+K14 -> 86 | D14: =C14/C$4 -> 0.44791666666666669 | E14: 57 | F14: =E14/E$4 -> 0.58163265306122447 | G14: 10 | H14: =G14/G$4 -> 00.2 | I14: 17 | J14: =I14/I$4 -> 0.54838709677419351 | K14: 2 | L14: =K14/K$4 -> 0.15384615384615385
B15: North Bay | C15: =E15+G15+I15+K15 -> 16 | D15: =C15/C$4 -> 8.3333333333333329E-2 | E15: 1 | F15: =E15/E$4 -> 1.020408163265306E-2 | G15: 3 | H15: =G15/G$4 -> 00.06 | I15: 0 | J15: =I15/I$4 -> 0 | K15: 12 | L15: =K15/K$4 -> 0.92307692307692313
B16: East Bay | C16: =E16+G16+I16+K16 -> 46 | D16: =C16/C$4 -> 0.23958333333333334 | E16: 3 | F16: =E16/E$4 -> 3.0612244897959183E-2 | G16: 40 | H16: =G16/G$4 -> 00.8 | I16: 2 | J16: =I16/I$4 -> 6.4516129032258063E-2 | K16: 1 | L16: =K16/K$4 -> 7.6923076923076927E-2
B17: San Jose | C17: =E17+G17+I17+K17 -> 50 | D17: =C17/C$4 -> 0.26041666666666669 | E17: 14 | F17: =E17/E$4 -> 0.14285714285714285 | G17: 8 | H17: =G17/G$4 -> 00.16 | I17: 27 | J17: =I17/I$4 -> 0.87096774193548387 | K17: 1 | L17: =K17/K$4 -> 7.6923076923076927E-2
A18: help coordinate? | B18: yes | C18: =E18+G18+I18+K18 -> 53 | D18: =C18/C$4 -> 0.27604166666666669 | E18: 25 | F18: =E18/E$4 -> 0.25510204081632654 | G18: 18 | H18: =G18/G$4 -> 00.36 | I18: 9 | J18: =I18/I$4 -> 0.29032258064516131 | K18: 1 | L18: =K18/K$4 -> 7.6923076923076927E-2
B19: maybe | C19: =E19+G19+I19+K19 -> 9 | D19: =C19/C$4 -> 4.6875E-2 | E19: 4 | F19: =E19/E$4 -> 4.0816326530612242E-2 | G19: 3 | H19: =G19/G$4 -> 00.06 | I19: 1 | J19: =I19/I$4 -> 3.2258064516129031E-2 | K19: 1 | L19: =K19/K$4 -> 7.6923076923076927E-2
A20: how far/wkday? | B20: 0-25 mi | C20: =E20+G20+I20+K20 -> 130 | D20: =C20/C$4 -> 0.67708333333333337 | E20: 68 | F20: =E20/E$4 -> 0.69387755102040816 | G20: 33 | H20: =G20/G$4 -> 00.66 | I20: 19 | J20: =I20/I$4 -> 0.61290322580645162 | K20: 10 | L20: =K20/K$4 -> 0.76923076923076927
B21: 25-50 mi | C21: =E21+G21+I21+K21 -> 52 | D21: =C21/C$4 -> 0.27083333333333331 | E21: 26 | F21: =E21/E$4 -> 0.26530612244897961 | G21: 15 | H21: =G21/G$4 -> 00.3 | I21: 9 | J21: =I21/I$4 -> 0.29032258064516131 | K21: 2 | L21: =K21/K$4 -> 0.15384615384615385
B22: 50-75 mi | C22: =E22+G22+I22+K22 -> 3 | D22: =C22/C$4 -> 1.5625E-2 | E22: 0 | F22: =E22/E$4 -> 0 | G22: 0 | H22: =G22/G$4 -> 0 | I22: 2 | J22: =I22/I$4 -> 6.4516129032258063E-2 | K22: 1 | L22: =K22/K$4 -> 7.6923076923076927E-2
B23: >75 mi | C23: =E23+G23+I23+K23 -> 1 | D23: =C23/C$4 -> 5.208333333333333E-3 | E23: 0 | F23: =E23/E$4 -> 0 | G23: 1 | H23: =G23/G$4 -> 00.02 | I23: 0 | J23: =I23/I$4 -> 0 | K23: 0 | L23: =K23/K$4 -> 0
A24: how far/wknd? | B24: 0-25 mi | C24: =E24+G24+I24+K24 -> 38 | D24: =C24/C$4 -> 0.19791666666666666 | E24: 21 | F24: =E24/E$4 -> 0.21428571428571427 | G24: 8 | H24: =G24/G$4 -> 00.16 | I24: 4 | J24: =I24/I$4 -> 0.12903225806451613 | K24: 5 | L24: =K24/K$4 -> 0.38461538461538464
B25: 25-50 mi | C25: =E25+G25+I25+K25 -> 85 | D25: =C25/C$4 -> 0.44270833333333331 | E25: 45 | F25: =E25/E$4 -> 0.45918367346938777 | G25: 23 | H25: =G25/G$4 -> 00.46 | I25: 12 | J25: =I25/I$4 -> 0.38709677419354838 | K25: 5 | L25: =K25/K$4 -> 0.38461538461538464
B26: 50-75 mi | C26: =E26+G26+I26+K26 -> 38 | D26: =C26/C$4 -> 0.19791666666666666 | E26: 18 | F26: =E26/E$4 -> 0.18367346938775511 | G26: 7 | H26: =G26/G$4 -> 00.14 | I26: 11 | J26: =I26/I$4 -> 0.35483870967741937 | K26: 2 | L26: =K26/K$4 -> 0.15384615384615385
B27: >75 mi | C27: =E27+G27+I27+K27 -> 20 | D27: =C27/C$4 -> 0.10416666666666667 | E27: 8 | F27: =E27/E$4 -> 8.1632653061224483E-2 | G27: 8 | H27: =G27/G$4 -> 00.16 | I27: 3 | J27: =I27/I$4 -> 9.6774193548387094E-2 | K27: 1 | L27: =K27/K$4 -> 7.6923076923076927E-2
A28: host? | B28: yes | C28: =E28+G28+I28+K28 -> 71 | D28: =C28/C$4 -> 0.36979166666666669 | E28: 36 | F28: =E28/E$4 -> 0.36734693877551022 | G28: 17 | H28: =G28/G$4 -> 00.34 | I28: 14 | J28: =I28/I$4 -> 0.45161290322580644 | K28: 4 | L28: =K28/K$4 -> 0.30769230769230771
B29: maybe | C29: =E29+G29+I29+K29 -> 9 | D29: =C29/C$4 -> 4.6875E-2 | E29: 4 | F29: =E29/E$4 -> 4.0816326530612242E-2 | G29: 3 | H29: =G29/G$4 -> 00.06 | I29: 1 | J29: =I29/I$4 -> 3.2258064516129031E-2 | K29: 1 | L29: =K29/K$4 -> 7.6923076923076927E-2
A31: when to meet | C31: where to meet
A32: San Francisco/Peninsula | C32: San Francisco/Peninsula
A33: weekday eve difficult w/ traffic | C33: rotate
A34: weekend brunch | C34: South Bay
C35: Cupertino
C36: near BART or CalTrain
C37: Oakland/Berkeley/East Bay
C38: San ramon, Livermore, tri valley
C39: North Bay
C40: rotate