B1: San Francisco Bay Area Alumni Group Survey
A2: OPPORTUNITIES/EVENTS
C3: Total | E3: SF/Peninsula | G3: Berk/East Bay | I3: Silicon Valley | K3: North Bay
A4: Total responses | D4: =F4+H4+J4+L4 -> 192 | F4: 98 | H4: 50 | J4: 31 | L4: 13
A5: opportunities? | B5: fellowship | C5: =E5+G5+I5+K5 -> 120 | D5: =C5/D$4 -> 0.625 | E5: 68 | F5: =E5/F$4 -> 0.69387755102040816 | G5: 27 | H5: =G5/H$4 -> 00.54 | I5: 15 | J5: =I5/J$4 -> 0.4838709677419355 | K5: 10 | L5: =K5/L$4 -> 0.76923076923076927
B6: mentoring | C6: =E6+G6+I6+K6 -> 56 | D6: =C6/D$4 -> 0.29166666666666669 | E6: 32 | F6: =E6/F$4 -> 0.32653061224489793 | G6: 12 | H6: =G6/H$4 -> 00.24 | I6: 11 | J6: =I6/J$4 -> 0.35483870967741937 | K6: 1 | L6: =K6/L$4 -> 7.6923076923076927E-2
B7: networking | C7: =E7+G7+I7+K7 -> 119 | D7: =C7/D$4 -> 0.61979166666666663 | E7: 65 | F7: =E7/F$4 -> 0.66326530612244894 | G7: 24 | H7: =G7/H$4 -> 00.48 | I7: 25 | J7: =I7/J$4 -> 0.80645161290322576 | K7: 5 | L7: =K7/L$4 -> 0.38461538461538464
B8: comm svc | C8: =E8+G8+I8+K8 -> 89 | D8: =C8/D$4 -> 0.46354166666666669 | E8: 47 | F8: =E8/F$4 -> 0.47959183673469385 | G8: 18 | H8: =G8/H$4 -> 00.36 | I8: 18 | J8: =I8/J$4 -> 0.58064516129032262 | K8: 6 | L8: =K8/L$4 -> 0.46153846153846156
B9: venture cap | C9: =E9+G9+I9+K9 -> 30 | D9: =C9/D$4 -> 0.15625 | E9: 14 | F9: =E9/F$4 -> 0.14285714285714285 | G9: 7 | H9: =G9/H$4 -> 00.14 | I9: 8 | J9: =I9/J$4 -> 0.25806451612903225 | K9: 1 | L9: =K9/L$4 -> 7.6923076923076927E-2
B10: support studnts | C10: =E10+G10+I10+K10 -> 60 | D10: =C10/D$4 -> 0.3125 | E10: 33 | F10: =E10/F$4 -> 0.33673469387755101 | G10: 15 | H10: =G10/H$4 -> 00.3 | I10: 10 | J10: =I10/J$4 -> 0.32258064516129031 | K10: 2 | L10: =K10/L$4 -> 0.15384615384615385
B11: prof dev't | C11: =E11+G11+I11+K11 -> 60 | D11: =C11/D$4 -> 0.3125 | E11: 29 | F11: =E11/F$4 -> 0.29591836734693877 | G11: 14 | H11: =G11/H$4 -> 00.28 | I11: 16 | J11: =I11/J$4 -> 0.5161290322580645 | K11: 1 | L11: =K11/L$4 -> 7.6923076923076927E-2
A12: types of events interested in? | B12: Rice VIP/faculty | C12: =E12+G12+I12+K12 -> 110 | D12: =C12/D$4 -> 0.57291666666666663 | E12: 64 | F12: =E12/F$4 -> 0.65306122448979587 | G12: 18 | H12: =G12/H$4 -> 00.36 | I12: 18 | J12: =I12/J$4 -> 0.58064516129032262 | K12: 10 | L12: =K12/L$4 -> 0.76923076923076927
B13: art/museum | C13: =E13+G13+I13+K13 -> 75 | D13: =C13/D$4 -> 0.390625 | E13: 39 | F13: =E13/F$4 -> 0.39795918367346939 | G13: 17 | H13: =G13/H$4 -> 00.34 | I13: 13 | J13: =I13/J$4 -> 0.41935483870967744 | K13: 6 | L13: =K13/L$4 -> 0.46153846153846156
B14: theater | C14: =E14+G14+I14+K14 -> 53 | D14: =C14/D$4 -> 0.27604166666666669 | E14: 31 | F14: =E14/F$4 -> 0.31632653061224492 | G14: 10 | H14: =G14/H$4 -> 00.2 | I14: 10 | J14: =I14/J$4 -> 0.32258064516129031 | K14: 2 | L14: =K14/L$4 -> 0.15384615384615385
B15: happy hour | C15: =E15+G15+I15+K15 -> 90 | D15: =C15/D$4 -> 0.46875 | E15: 49 | F15: =E15/F$4 -> 0.5 | G15: 23 | H15: =G15/H$4 -> 00.46 | I15: 15 | J15: =I15/J$4 -> 0.4838709677419355 | K15: 3 | L15: =K15/L$4 -> 0.23076923076923078
B16: family | C16: =E16+G16+I16+K16 -> 43 | D16: =C16/D$4 -> 0.22395833333333334 | E16: 15 | F16: =E16/F$4 -> 0.15306122448979592 | G16: 14 | H16: =G16/H$4 -> 00.28 | I16: 12 | J16: =I16/J$4 -> 0.38709677419354838 | K16: 2 | L16: =K16/L$4 -> 0.15384615384615385
B17: outdoors | C17: =E17+G17+I17+K17 -> 80 | D17: =C17/D$4 -> 0.41666666666666669 | E17: 42 | F17: =E17/F$4 -> 0.42857142857142855 | G17: 18 | H17: =G17/H$4 -> 00.36 | I17: 16 | J17: =I17/J$4 -> 0.5161290322580645 | K17: 4 | L17: =K17/L$4 -> 0.30769230769230771
B18: picnic/potluck | C18: =E18+G18+I18+K18 -> 73 | D18: =C18/D$4 -> 0.38020833333333331 | E18: 39 | F18: =E18/F$4 -> 0.39795918367346939 | G18: 19 | H18: =G18/H$4 -> 00.38 | I18: 14 | J18: =I18/J$4 -> 0.45161290322580644 | K18: 1 | L18: =K18/L$4 -> 7.6923076923076927E-2
B19: local sports | C19: =E19+G19+I19+K19 -> 27 | D19: =C19/D$4 -> 0.140625 | E19: 15 | F19: =E19/F$4 -> 0.15306122448979592 | G19: 8 | H19: =G19/H$4 -> 00.16 | I19: 4 | J19: =I19/J$4 -> 0.12903225806451613 | K19: 0 | L19: =K19/L$4 -> 0
B20: Rice sports | C20: =E20+G20+I20+K20 -> 57 | D20: =C20/D$4 -> 0.296875 | E20: 28 | F20: =E20/F$4 -> 0.2857142857142857 | G20: 19 | H20: =G20/H$4 -> 00.38 | I20: 9 | J20: =I20/J$4 -> 0.29032258064516131 | K20: 1 | L20: =K20/L$4 -> 7.6923076923076927E-2
B21: Rice sports on TV | C21: =E21+G21+I21+K21 -> 33 | D21: =C21/D$4 -> 0.171875 | E21: 15 | F21: =E21/F$4 -> 0.15306122448979592 | G21: 13 | H21: =G21/H$4 -> 00.26 | I21: 4 | J21: =I21/J$4 -> 0.12903225806451613 | K21: 1 | L21: =K21/L$4 -> 7.6923076923076927E-2
B22: parties w/ students | C22: =E22+G22+I22+K22 -> 53 | D22: =C22/D$4 -> 0.27604166666666669 | E22: 29 | F22: =E22/F$4 -> 0.29591836734693877 | G22: 17 | H22: =G22/H$4 -> 00.34 | I22: 6 | J22: =I22/J$4 -> 0.19354838709677419 | K22: 1 | L22: =K22/L$4 -> 7.6923076923076927E-2
B23: speaker series | C23: =E23+G23+I23+K23 -> 103 | D23: =C23/D$4 -> 0.53645833333333337 | E23: 50 | F23: =E23/F$4 -> 0.51020408163265307 | G23: 24 | H23: =G23/H$4 -> 00.48 | I23: 19 | J23: =I23/J$4 -> 0.61290322580645162 | K23: 10 | L23: =K23/L$4 -> 0.76923076923076927
A25: opportunities | C25: types of events interested in
A26: San Francisco/Peninsula | C26: San Francisco/Peninsula
A27: educational | C27: student send-off
A28: diverse calendar to attract different groups | C28: alumni college
A29: personal growth | C29: dinners at restaurants
A30: drum circle | C30: skating, tennis, cycling, golf, mini-golf, comedy club
A31: North Bay | C31: symphony/ballet/opera
A32: all state | C32: student send-off
A33: Oakland/Berkeley/East Bay | C33: fundraising as a Rice group (AIDS walk, Race for the Cure, etc.)
A34: (all good ideas) | C34: alumni speakers
A35: Silicon Valley | C35: wine trips
A36: alumni college | C36: dinners, wine tastings, networking sessions
A37: educational | C37: Oakland/Berkeley/East Bay
A38: on-campus recruiting at Rice | C38: wine tasting
A39: North Bay | C39: camping trip/outdoors
A40: educational | C40: Silicon Valley
C41: alumni college
C42: wine tasting
C43: alumni college; golf outing
C44: North Bay
C45: archi walk tour of sf
C46: archi/historical tours